<?xml version="1.0" encoding="UTF-8"?>
<!DOCTYPE mephi SYSTEM "mephi.dtd">
<mephi xmlns:xsi="http://www.w3.org/2001/XMLSchema-instance"
xsi:noNamespaceSchemaLocation="/home/student/db36/all_labs/xsd/mephi.xsd">

  <faculty name="K">
    <kafedra number="36">
      <group num="1" year="2012">
        <student>Артемьев Дмитрий</student>
        <student>Анисимова Наталья</student>
        <student>Бубенко Кирилл</student>
        <student>Джелоухова Алена</student>
        <student>Заманов Айнур</student>
        <student>Михеев Денис</student>
        <student>Пивоваров Александр</student>
        <student>Самсонов Артем</student>
        <student>Соловьева Аня</student>
        <student>Суханова Любовь</student>
        <student>Тармазаков Евгений</student>
        <student>Титоренко Алексей</student>
        <student>Штанько Александр</student>
      </group>
      <group num="2" year="2012">
        <student>Ахметсафин Владислав</student>
        <student>Галкин Александр</student>
        <student>Головко Ирина</student>
        <student>Джумайло Евгений</student>
        <student>Ерохин Владимир</student>
        <student>Каталкина Виктория</student>
        <student>Левин Андрей</student>
        <student>Молочков Ярослав</student>
        <student>Моряшова Виктория</student>
        <student>Полстянкин Константин</student>
        <student>Пурик Яна</student>
        <student>Разживин Никита</student>
        <student>Редюк Сергей</student>
        <student>Рябов Петр</student>
        <student>Скок Дарья</student>
        <student>Стрекалов Олег</student>
        <student>Чухненко Александра</student>
      </group>
    </kafedra>
  </faculty>
 <faculty name='A'>
 </faculty>
 <faculty name='T'>
 </faculty>
 <faculty name='F'>
 </faculty>
 <faculty name='U'>
 </faculty>
</mephi>  
</mephi>
